structured_name,simple_name,airr_object,VDJbase table,existing VDJbase attribute,YML attribute,type,display,hide,size,list,title,description,example,notes
Repertoire.data_processing.DataProcessing.primary_annotation,primary_annotation,data_processing,DataPro,,,boolean,TRUE,TRUE,long,TRUE,Primary annotation,"If true, indicates this is the primary or default data processing for the repertoire and its rearrangements. If false, indicates this is a secondary or additional data processing.
",,
Repertoire.data_processing.DataProcessing.software_versions,software_versions,data_processing,DataPro,,,string,TRUE,TRUE,long,TRUE,Software tools,"Version number and / or date, include company pipelines",IgBLAST 1.6,
Repertoire.data_processing.DataProcessing.paired_reads_assembly,paired_reads_assembly,data_processing,DataPro,,,string,TRUE,TRUE,long,TRUE,Paired read assembly,How paired end reads were assembled into a single receptor sequence,"PandaSeq (minimal overlap 50, threshold 0.8)",
Repertoire.data_processing.DataProcessing.quality_thresholds,quality_thresholds,data_processing,DataPro,,,string,TRUE,TRUE,long,TRUE,Quality thresholds,How sequences were removed from (4) based on base quality scores,Average Phred score >=20,
Repertoire.data_processing.DataProcessing.primer_match_cutoffs,primer_match_cutoffs,data_processing,DataPro,,,string,TRUE,TRUE,long,TRUE,Primer match cutoffs,"How primers were identified in the sequences, were they removed/masked/etc?",Hamming distance <= 2,
Repertoire.data_processing.DataProcessing.collapsing_method,collapsing_method,data_processing,DataPro,,,string,TRUE,TRUE,long,TRUE,Collapsing method,The method used for combining multiple sequences from (4) into a single sequence in (5),MUSCLE 3.8.31,
Repertoire.data_processing.DataProcessing.data_processing_protocols,data_processing_protocols,data_processing,DataPro,,,string,TRUE,TRUE,long,TRUE,Data processing protocols,General description of how QC is performed,Data was processed using [...],
Repertoire.data_processing.DataProcessing.data_processing_files,data_processing_files,data_processing,DataPro,,,string,TRUE,TRUE,long,TRUE,Processed data file names,,,
Repertoire.data_processing.DataProcessing.germline_database,germline_database,data_processing,DataPro,,,string,TRUE,TRUE,long,TRUE,V(D)J germline reference,Source of germline V(D)J genes with version number or date accessed.,"ENSEMBL, Homo sapiens build 90, 2017-10-01",
Repertoire.data_processing.DataProcessing.analysis_provenance_id,analysis_provenance_id,data_processing,DataPro,,,string,TRUE,TRUE,long,TRUE,Analysis provenance ID,Identifier for machine-readable PROV model of analysis provenance,,
,num_subjects,,Study,num_subjects,Number of Subjects,integer,TRUE,TRUE,short,FALSE,Subjects,Number of subjects in the study,,Derived at take-on
,num_samples,,Study,num_samples,Number of Samples,integer,TRUE,TRUE,short,FALSE,Samples,Number of samples in the study,,Derived at take-on
,accession_reference,,Study,accession_reference,,string,TRUE,TRUE,long,FALSE,Study Ref,"URL of the study in the registry
",,Derived from study.study_id
,sub_cell_type,,TissuePro,sub_cell_type,Tissue Processing.Sub Cell Type,string,TRUE,TRUE,long,FALSE,Sub Cell Type,Sub cell type,,?
,patient_name,,Patient,name,Subjects.Name,string,TRUE,TRUE,short,FALSE,Subject name,Subject name as allocated by VDJbase,,Determined by pipeline
,igsnper_sample_id,,Patient,igsnper_sample_id,,integer,FALSE,TRUE,short,FALSE,Igsnper Sample ID,Sample ID as allocated by IgSNPer,,Detemined at take-on
,sample_name,,Sample,name,Samples.Name,string,TRUE,FALSE,short,FALSE,Sample name,Sample name as allocated by VDJbase,,Determined by pipeline
,reads,,Sample,reads,Samples.Reads,integer,TRUE,FALSE,short,FALSE,VDJbase reads,Reads processed by VDJbase pipeline,,Determined by pipeline
,genotypes,,Sample,genotype,,genotype,TRUE,FALSE,short,FALSE,Genotype report,Links to genotype reports,,Derived at take-on
,haplotypes,,Sample,haplotype,,haplotype,TRUE,FALSE,long,FALSE,Haplotype reports,Links to haplotype reports,,
,igsnper_plot_path,,Sample,igsnper_plot_path,,string,TRUE,TRUE,long,FALSE,Igsnper plot path,Path for igsnper plot,,
,sample_group,,Sample,sample_group,Samples.Sample Group,string,TRUE,TRUE,long,FALSE,Sample group,Sample group,,? Possibly sample_processing_id
,genotype_stats,,Sample,genotype_stats,,string,FALSE,TRUE,long,FALSE,Genotype stats,Path to genotype stats file,,
,genotype_report,,Sample,genotype_report,,string,FALSE,TRUE,long,FALSE,Genotype report,Path to genotype report,,
,study_name,,Study,name,,string,TRUE,TRUE,short,FALSE,Study name,Study name,,
,prepro_tool,,GenoDetection,prepro_tool,Genotype Detections.Pre-processing,string,TRUE,TRUE,long,FALSE,Preprocessing tool,Preprocessing tool,PRESTO,
,aligner_tool,,GenoDetection,aligner_tool,Genotype Detections.Alignment Tool,string,TRUE,TRUE,long,FALSE,Aligner tool,Aligner tool,IgBLAST,
,aligner_ver,,GenoDetection,aligner_ver,Genotype Detections.Aligner Version,string,TRUE,TRUE,long,FALSE,Aligner version,Aligner version,1.18,
,aligner_reference_v,,GenoDetection,aligner_reference_v,Genotype Detections.Alignment reference v,string,TRUE,TRUE,long,FALSE,Aligner ref V,Aligner ref V,IMGT full - version 2021-06-06,
,aligner_reference_d,,GenoDetection,aligner_reference_d,Genotype Detections.Alignment reference d,string,TRUE,TRUE,long,FALSE,Aligner ref D,Aligner ref D,IMGT full - version 2021-06-06,
,aligner_reference_j,,GenoDetection,aligner_reference_j,Genotype Detections.Alignment reference j,string,TRUE,TRUE,long,FALSE,Aligner ref J,Aligner ref J,IMGT full - version 2021-06-06,
,geno_tool,,GenoDetection,geno_tool,Genotype Detections.Genotyper Tool,string,TRUE,TRUE,long,FALSE,Genotyping tool,Genotyping tool,TIgGER,
,geno_ver,,GenoDetection,geno_ver,Genotype Detections.Genotyper Version,string,TRUE,TRUE,long,FALSE,Genotyping tool version,Genotyping tool version,1.2,
,haplotype_tool,,GenoDetection,haplotype_tool,Genotype Detections.Haplotyper Tool,string,TRUE,TRUE,long,FALSE,Haplotyping tool,Haplotyping tool,RabHIT,
,haplotype_ver,,GenoDetection,haplotype_ver,Genotype Detections.Haplotyper Version,string,TRUE,TRUE,long,FALSE,Haplotyping tool version,Haplotyping tool version,1.2,
,single_assignment,,GenoDetection,single_assignment,Genotype Detections.Single Assignment,boolean,TRUE,TRUE,long,FALSE,Single assignment,TRUE if the processed reads are restricted to those that have a single V_call,TRUE,
,sample_basis,,GenoDetection,sample_basis,Genotype Detections.Repertoire or Germline,string,TRUE,TRUE,short,FALSE,Sample basis,Repertoire or germline,Germline,
